year,year_label,project,value_chain,status,category,note
2025,Sept 2025,KMC Bus & EV Plant operational,Automotive,complete,Manufacturing,"Output 2,500 vehicles/yr today; target 10,000+/yr by 2040 plus regional EV-bus supply"
2025,2025,Kilembe Copper-Cobalt PSA signed,Copper & Allied Metals,in_progress,Minerals,"Production sharing agreement signed; mine still dormant pending development capital"
2026,2026,Two new cement plants under construction,Cement & Building Materials,in_progress,Manufacturing,"Closes clinker self-sufficiency gap from <50% toward >90% target"
2029,~2029-30,Kabalega Refinery first oil,Petrochemicals & Fertilizers,planned,Infrastructure,"Enables domestic fuel and polymer feedstock — unlocks the Plastics & Packaging chain"
2030,FY2029/30,NDP IV target horizon,All chains,milestone,Policy,"Manufacturing share of GDP target 21%; capacity utilisation target 60%"
2031,~2031,Kabalega Petrochemical Park operational,Plastics & Packaging,planned,Infrastructure,"Domestic polymer resin ends 100% import dependency on plastics feedstock"
2040,2040,Tenfold Growth target horizon,All chains,milestone,Policy,"Manufacturing share of GDP target 30%; GDP ~USD 500B; capacity utilisation 80%"
